{
    "$schema": "..\\schema\\plugin.schema.json",
    "id": "sharwapi.apimgr",
    "auth": {
        "gpg_fingerprint": "D0CFD1598CB88E59165A6F595507630E4F33F4B1"
    },
    "name": "API Manager",
    "author": "SharwOrange",
    "description_en": "A plugin that provides management interfaces for APIs",
    "description_zh": "一个用于为API提供管理接口的插件",
    "url": "https://github.com/sharwapi/sharwapi.Plugin.apimgr"
}