{
    "$schema": "..\\schema\\plugin.schema.json",
    "id": "guard",
    "auth": {
        "gpg_fingerprint": "D0CFD1598CB88E59165A6F595507630E4F33F4B1"
    },
    "name": "Route Guard",
    "author": "SharwOrange",
    "description_en": "A simple plugin that protects API routes using token-based authentication",
    "description_zh": "一个简单的使用token方式保护API路由的插件",
    "url": "https://github.com/sharwapi/sharwapi.Plugin.guard"
}